{
  "archetypes": [
    "qualitative-field"
  ],
  "critical_defects": [
    {
      "description": "Uses supervisors to recruit direct reports",
      "id": "coercive-recruitment",
      "severity": "critical"
    },
    {
      "description": "Reduces identity change to an unjustified single score",
      "id": "forced-metric",
      "severity": "major"
    }
  ],
  "domain": "organizational sociology",
  "forbidden_assumptions": [
    {
      "description": "Do not allow managers to know who participated.",
      "id": "manager-access",
      "severity": "critical"
    }
  ],
  "hidden_brief": {
    "answer_policy": "Do not volunteer publication ambition until audience/output is asked.",
    "facts": {
      "access": "company can invite but participation must be voluntary",
      "method": "interviews plus document analysis",
      "participants": "employees and managers across three regions",
      "purpose": "internal learning with possible academic paper later",
      "sensitivity": "employment power dynamics"
    },
    "knowledge_limits": [
      "whether saturation is reachable",
      "whether publication permission will be granted"
    ]
  },
  "id": "remote-work-qualitative",
  "initial_request": "Help me understand how remote work changed professional identity at our company.",
  "material_dimensions": [
    {
      "acceptable_resolution": [
        "explicit user answer",
        "safe reversible default with rationale",
        "explicit blocker"
      ],
      "answer_key": "internal learning first; publication is contingent",
      "expected_by_turn": 1,
      "forces_blocker": false,
      "id": "purpose-audience",
      "importance": "critical"
    },
    {
      "acceptable_resolution": [
        "explicit user answer",
        "safe reversible default with rationale",
        "explicit blocker"
      ],
      "answer_key": "employees/managers in three regions",
      "expected_by_turn": 2,
      "forces_blocker": false,
      "id": "participant-scope",
      "importance": "material"
    },
    {
      "acceptable_resolution": [
        "explicit user answer",
        "safe reversible default with rationale",
        "explicit blocker"
      ],
      "answer_key": "voluntary recruitment outside supervisory chains",
      "expected_by_turn": 3,
      "forces_blocker": false,
      "id": "power-consent",
      "importance": "critical"
    },
    {
      "acceptable_resolution": [
        "explicit user answer",
        "safe reversible default with rationale",
        "explicit blocker"
      ],
      "answer_key": "de-identification and limits on reporting small groups",
      "expected_by_turn": 4,
      "forces_blocker": false,
      "id": "confidentiality",
      "importance": "critical"
    },
    {
      "acceptable_resolution": [
        "explicit user answer",
        "safe reversible default with rationale",
        "explicit blocker"
      ],
      "answer_key": "semi-structured interviews plus policy/document analysis",
      "expected_by_turn": 5,
      "forces_blocker": false,
      "id": "method",
      "importance": "material"
    },
    {
      "acceptable_resolution": [
        "explicit user answer",
        "safe reversible default with rationale",
        "explicit blocker"
      ],
      "answer_key": "identity work and occupational community, open to revision",
      "expected_by_turn": 6,
      "forces_blocker": false,
      "id": "interpretive-framework",
      "importance": "material"
    },
    {
      "acceptable_resolution": [
        "explicit user answer",
        "safe reversible default with rationale",
        "explicit blocker"
      ],
      "answer_key": "separate permission and ethics review before academic publication",
      "expected_by_turn": 7,
      "forces_blocker": true,
      "id": "publication-rights",
      "importance": "critical"
    }
  ],
  "profile": "standard",
  "question_budget": {
    "hard": 12,
    "soft": 8
  },
  "required_campaign_features": [
    {
      "description": "researcher positionality and reflexivity",
      "id": "positionality"
    },
    {
      "description": "actively seek disconfirming accounts",
      "id": "negative-cases"
    },
    {
      "description": "role/region variation and stopping rationale",
      "id": "sampling-logic"
    },
    {
      "description": "voluntariness and reporting safeguards",
      "id": "consent-confidentiality"
    }
  ],
  "title": "Remote work and professional identity"
}
